{
  "$schema": "https://json-schema.org/draft/2020-12/schema",
  "type": "array",
  "items": {
    "type": "object",
    "properties": {
      "slug": {
        "type": "string"
      },
      "name": {
        "type": "string"
      },
      "quality": {
        "type": "string"
      },
      "relatingTo": {
        "type": "string"
      },
      "spirit": {
        "type": "string"
      },
      "kerub": {
        "type": "string"
      }
    },
    "required": [
      "slug",
      "name",
      "quality",
      "relatingTo",
      "spirit",
      "kerub"
    ],
    "additionalProperties": false
  }
}
